Name, Age, Hobby 1, Hobby 2, Hobby 3, Hobby 4, Hobby 5
User 1, 25, Reading, Hiking, Cooking, Painting, Cycling
User 2, 30, Swimming, Photography, Gardening, Yoga, Traveling
User 3, 22, Dancing, Gaming, Running, Singing, Drawing
User 4, 35, Fishing, Watching Movies, Playing Guitar, Camping, Bird Watching
User 5, 28, Playing Chess, Biking, Traveling, Cooking, Painting
User 6, 29, Playing Piano, Swimming, Hiking, Photography, Reading
User 7, 27, Running, Painting, Writing, Gardening, Photography
User 8, 32, Traveling, Dancing, Cooking, Watching Movies, Playing Guitar
User 9, 26, Playing Soccer, Cycling, Yoga, Painting, Singing
User 10, 31, Bird Watching, Drawing, Gaming, Hiking, Photography
User 11, 23, Playing Guitar, Reading, Camping, Biking, Cooking
User 12, 24, Singing, Painting, Swimming, Running, Writing
User 13, 34, Photography, Gardening, Traveling, Dancing, Hiking
User 14, 33, Playing Chess, Cooking, Playing Piano, Watching Movies, Cycling
User 15, 20, Gaming, Bird Watching, Drawing, Yoga, Swimming
